{
  "agent_status": "continue",
  "diagnosis": [
    "Pilot dependencies and metrics still need clarification."
  ],
  "updated_resources_pilot_viability": {
    "human_resources": "Pilot delivery is owned by one clinical lead and one project coordinator.",
    "technical_resources": "The pilot uses the existing secure web application and hospital SSO.",
    "pilot_environment": "The pilot runs in the outpatient intake workflow for one clinic site.",
    "dependencies": [],
    "indicators_metrics": [],
    "constraints": [
      "Staff availability limits pilot sessions to weekday mornings."
    ],
    "operational_risks": [],
    "assumptions": [
      "Clinic staff can reserve time for weekly review."
    ],
    "uncertainties": [
      "Exact pilot start date remains to be confirmed."
    ]
  },
  "next_question": "What operational dependencies, metrics, and risks should be tracked before the pilot starts?",
  "completion_reason": ""
}
