{
  "agent_status": "done",
  "diagnosis": [
    "Minimum pilot execution inputs are sufficiently defined."
  ],
  "updated_resources_pilot_viability": {
    "human_resources": "Pilot delivery is owned by one clinical lead, two nurses, and one project coordinator.",
    "technical_resources": "The pilot uses an existing secure web app, hospital SSO, and an audit log dashboard.",
    "pilot_environment": "The pilot runs in the outpatient intake workflow for one clinic site during weekday hours.",
    "dependencies": [
      "Hospital SSO access and clinic manager scheduling must be ready before launch."
    ],
    "indicators_metrics": [
      "Weekly completed intake summaries and staff correction rate."
    ],
    "constraints": [
      "Staff availability and site access limit pilot sessions to weekday mornings."
    ],
    "operational_risks": [
      "Late SSO provisioning could delay onboarding and reduce first-week usage."
    ],
    "assumptions": [
      "Clinic staff can reserve time for weekly review."
    ],
    "uncertainties": [
      "Exact pilot start date remains to be confirmed."
    ]
  },
  "next_question": "",
  "completion_reason": "resources pilot viability inputs sufficiently clarified"
}
